<?xml version="1.0" encoding="UTF-8" standalone="yes"?>
<Methods xmlns:xsi="http://www.w3.org/2001/XMLSchema-instance" xsi:noNamespaceSchemaLocation="..\..\xml\methods.xsd">


	<Method>
		<Name>jcolibri.extensions.web.method.WebPreCycleMethod</Name>
		<Description>Pre cycle method that launches the web server and loads the case base</Description>
		<Type>Decomposition</Type>
		<Competencies>
			<Competence>PreCycle</Competence>
		</Competencies>
		<SubTasks>
			<SubTask>Start Web Server task</SubTask>
			<SubTask>Obtain cases task</SubTask>
		</SubTasks>
	</Method>

	<Method>
		<Name>jcolibri.extensions.web.method.WebPostCycleMethod</Name>
		<Description>Post cycle method that stops the web server and stores the case base</Description>
		<Type>Decomposition</Type>
		<Competencies>
			<Competence>PostCycle</Competence>
		</Competencies>
		<SubTasks>
			<SubTask>Stop Web Server task</SubTask>
			<SubTask>Close connector task</SubTask>
		</SubTasks>
	</Method>



	<Method>
		<Name>jcolibri.extensions.web.method.StartTomcatMethod</Name>
		<Description>Starts Tomcat web server</Description>
		<Type>Resolution</Type>
		<Competencies>
			<Competence>Start Web Server task</Competence>
		</Competencies>
	</Method>


	<Method>
		<Name>jcolibri.extensions.web.method.StopTomcatMethod</Name>
		<Description>Starts Tomcat web server</Description>
		<Type>Resolution</Type>
		<Competencies>
			<Competence>Stop Web Server task</Competence>
		</Competencies>
	</Method>

	<Method>
		<Name>jcolibri.extensions.web.method.ObtainWebQueryMethod</Name>
		<Description>Obtains the query from the web server</Description>
		<Type>Resolution</Type>
		<Parameters>
			<Parameter>
				<Name>Case Structure</Name>
				<Description>XML file generated by jCOLIBRI tools</Description>
				<DataType>File</DataType>
			</Parameter>
			<Parameter>
				<Name>Time out</Name>
				<Description>Maximum time that cycle waits for the query</Description>
				<DataType>Integer</DataType>
			</Parameter>
		</Parameters>
		<Competencies>
			<Competence>Obtain query task</Competence>
		</Competencies>
	</Method>
	
	<Method>
		<Name>jcolibri.extensions.web.method.CBRWebMethod</Name>
		<Description>Main CBR method that will divide CBR process in the four typical tasks and some extra tasks for cycle synchronization with the web server</Description>
		<Type>Decomposition</Type>
		<Competencies>
			<Competence>CBR Cycle</Competence>
		</Competencies>
		<SubTasks>
			<SubTask>Start Web Cycle task</SubTask>
			<SubTask>Obtain query task</SubTask>
			<SubTask>Retrieve Task</SubTask>
			<SubTask>Reuse Task</SubTask>
			<SubTask>Revise Task</SubTask>
			<SubTask>Retain Task</SubTask>
			<SubTask>Stop Web Cycle task</SubTask>
		</SubTasks>
	</Method>

	<Method>
		<Name>jcolibri.extensions.web.method.StartWebCycleMethod</Name>
		<Description>Starts the web CBR cycle</Description>
		<Type>Resolution</Type>
		<Competencies>
			<Competence>Start Web Cycle task</Competence>
		</Competencies>
	</Method>
	
	<Method>
		<Name>jcolibri.extensions.web.method.StopWebCycleMethod</Name>
		<Description>Stops the web CBR cycle</Description>
		<Type>Resolution</Type>
		<Competencies>
			<Competence>Stop Web Cycle task</Competence>
		</Competencies>
	</Method>

	<Method>
		<Name>jcolibri.extensions.web.method.RetrieveComputationalForWebServerMethod</Name>
		<Description>Simple retrieve strategy that sends the cases to the Web Server</Description>
		<Type>Decomposition</Type>
		<Competencies>
			<Competence>Retrieve Task</Competence>
		</Competencies>
		<SubTasks>
			<SubTask>Select working cases task</SubTask>
			<SubTask>Compute similarity task</SubTask>
			<SubTask>Select best task</SubTask>
			<SubTask>Send Cases to Web Server task</SubTask>
		</SubTasks>
	</Method>

	
	<Method>
		<Name>jcolibri.extensions.web.method.SendCasesToWebServerMethod</Name>
		<Description>Sends retrieved cases to the Web Server</Description>
		<Type>Resolution</Type>
		<Competencies>
			<Competence>Send Cases to Web Server task</Competence>
		</Competencies>
	</Method>


</Methods>