<?xml version="1.0" encoding="UTF-8" standalone="yes"?>
<Methods xmlns:xsi="http://www.w3.org/2001/XMLSchema-instance" xsi:noNamespaceSchemaLocation="..\..\xml\methods.xsd">
	<Method>
		<Name>jcolibri.extensions.DL.method.LoadDLCaseBaseMethod</Name>
		<Description>Loads the Case Base from a DLs Reasoner</Description>
		<Type>Resolution</Type>
		<Parameters>
			<Parameter>
				<Name>Case Structure</Name>
				<Description>Case Structure configuration file</Description>
				<DataType>File</DataType>
			</Parameter>
		</Parameters>
		<Competencies>
			<Competence>Obtain cases task</Competence>
		</Competencies>
	</Method>
	<Method>
		<Name>jcolibri.extensions.DL.method.ConfigureDLQueryMethod</Name>
		<Description>Asks user for the DL query using the XML file generated by jCOLIBRI tools. It also configures similarity functions.</Description>
		<Type>Resolution</Type>
		<Parameters>
			<Parameter>
				<Name>Case Structure</Name>
				<Description>XML file generated by jCOLIBRI tools</Description>
				<DataType>File</DataType>
			</Parameter>
		</Parameters>
		<Competencies>
			<Competence>Obtain query task</Competence>
		</Competencies>
	</Method>
	
	<Method>
		<Name>jcolibri.extensions.DL.method.DLAdaptationMethod</Name>
		<Description>Performs several adaptations defined by rules</Description>
		<Type>Resolution</Type>
		<Parameters>
			<Parameter>
				<Name>Rules file</Name>
				<Description>Adapatation rules file</Description>
				<DataType>File</DataType>
			</Parameter>
			<Parameter>
				<Name>Solution Attribute</Name>
				<Description>Attribute of the solution that contains the concept type value that links with the instance to adapt</Description>
				<DataType>String</DataType>
			</Parameter>
		</Parameters>
		<Competencies>
			<Competence>Atomic Reuse Task</Competence>
		</Competencies>
	</Method>
</Methods>