<?xml version="1.0" encoding="UTF-8" standalone="yes"?>
<Methods xmlns:xsi="http://www.w3.org/2001/XMLSchema-instance" xsi:noNamespaceSchemaLocation="..\..\xml\methods.xsd">
	<Method>
		<Name>jcolibri.method.LoadCaseBaseMethod</Name>
		<Description>Loads the Case Base from the persistence layer, using a connector configured in a xml file</Description>
		<Type>Resolution</Type>
		<Parameters>
			<Parameter>
				<Name>Connector</Name>
				<Description>Connector configuration file</Description>
				<DataType>File</DataType>
			</Parameter>
		</Parameters>
		<Competencies>
			<Competence>Obtain cases task</Competence>
		</Competencies>
	</Method>
	<Method>
		<Name>jcolibri.method.SelectBestCaseMethod</Name>
		<Description>Selects just the best of the found cases</Description>
		<Type>Resolution</Type>
		<Competencies>
			<Competence>Select best task</Competence>
		</Competencies>
	</Method>
	<Method>
		<Name>jcolibri.method.RetrieveComputationalMethod</Name>
		<Description>Simple retrieve strategy</Description>
		<Type>Decomposition</Type>
		<Competencies>
			<Competence>Retrieve Task</Competence>
		</Competencies>
		<SubTasks>
			<SubTask>Select working cases task</SubTask>
			<SubTask>Compute similarity task</SubTask>
			<SubTask>Select best task</SubTask>
		</SubTasks>
	</Method>
	<Method>
		<Name>jcolibri.method.CBRSystemMethod</Name>
		<Description>Divides our CBR system into precycle/cycle/postcycle</Description>
		<Type>Decomposition</Type>
		<Competencies>
			<Competence>CBR System</Competence>
		</Competencies>
		<SubTasks>
			<SubTask>PreCycle</SubTask>
			<SubTask>CBR Cycle</SubTask>
			<SubTask>PostCycle</SubTask>
		</SubTasks>
	</Method>

	<Method>
		<Name>jcolibri.method.PreCycleMethod</Name>
		<Description>Standard pre cycle method</Description>
		<Type>Decomposition</Type>
		<Competencies>
			<Competence>PreCycle</Competence>
		</Competencies>
		<SubTasks>
			<SubTask>Obtain cases task</SubTask>
		</SubTasks>
	</Method>

	<Method>
		<Name>jcolibri.method.PostCycleMethod</Name>
		<Description>Standard post cycle method</Description>
		<Type>Decomposition</Type>
		<Competencies>
			<Competence>PostCycle</Competence>
		</Competencies>
		<SubTasks>
			<SubTask>Close connector task</SubTask>
		</SubTasks>
	</Method>

	
	
	<Method>
		<Name>jcolibri.method.CloseConnectorMethod</Name>
		<Description>Closes the case base releasing connector resources</Description>
		<Type>Resolution</Type>
		<Competencies>
			<Competence>Close connector task</Competence>
		</Competencies>
	</Method>

	<Method>
		<Name>jcolibri.method.SelectAllCasesMethod</Name>
		<Description>Stores all cases as working cases</Description>
		<Type>Resolution</Type>
		<Competencies>
			<Competence>Select working cases task</Competence>
		</Competencies>
	</Method>
	
	<Method>
		<Name>jcolibri.method.CBRMethod</Name>
		<Description>Main CBR method that will divide CBR process in the four typical tasks.</Description>
		<Type>Decomposition</Type>
		<Competencies>
			<Competence>CBR Cycle</Competence>
		</Competencies>
		<SubTasks>
			<SubTask>Obtain query task</SubTask>
			<SubTask>Retrieve Task</SubTask>
			<SubTask>Reuse Task</SubTask>
			<SubTask>Revise Task</SubTask>
			<SubTask>Retain Task</SubTask>
		</SubTasks>
	</Method>
	<Method>
		<Name>jcolibri.method.NumericSimComputationMethod</Name>
		<Description>Applies simple numeric similarity measures to cases</Description>
		<Type>Resolution</Type>
		<Competencies>
			<Competence>Compute similarity task</Competence>
		</Competencies>
	</Method>
	<Method>
		<Name>jcolibri.method.SelectSomeCasesMethod</Name>
		<Description>Select the cases indicated by user</Description>
		<Type>Resolution</Type>
		<Parameters>
			<Parameter>
				<Name>Number of cases</Name>
				<Description>Number of cases to be returned</Description>
				<DataType>Integer</DataType>
			</Parameter>
		</Parameters>
		<Competencies>
			<Competence>Select best task</Competence>
		</Competencies>
	</Method>
		<Method>
		<Name>jcolibri.method.ConfigureQueryMethod</Name>
		<Description>Asks user for the query using the XML file generated by jCOLIBRI tools. It also configures similarity functions.</Description>
		<Type>Resolution</Type>
		<Parameters>
			<Parameter>
				<Name>Case Structure</Name>
				<Description>XML file generated by jCOLIBRI tools</Description>
				<DataType>File</DataType>
			</Parameter>
		</Parameters>
		<Competencies>
			<Competence>Obtain query task</Competence>
		</Competencies>
	</Method>

	<Method>
		<Name>jcolibri.method.ReuseComputationalMethod</Name>
		<Description>Simple reuse strategy. Divides a reuse task into atomic reuse tasks and a main Reuse Task. This way, developers can apply several reuse methods.</Description>
		<Type>Decomposition</Type>
		<Competencies>
			<Competence>Reuse Task</Competence>
		</Competencies>
		<SubTasks>
			<SubTask>Prepare Cases for Adaptation Task</SubTask>
			<SubTask>Atomic Reuse Task</SubTask>
			<SubTask>Atomic Reuse Task</SubTask>
			<SubTask>Atomic Reuse Task</SubTask>
			<SubTask>Atomic Reuse Task</SubTask>
			<SubTask>Atomic Reuse Task</SubTask>
			<SubTask>Reuse Task</SubTask>
		</SubTasks>
	</Method>


<Method>
		<Name>jcolibri.method.CopyCasesforAdaptationMethod</Name>
		<Description>Removes evaluation data in retrieved cases.</Description>
		<Type>Resolution</Type>
		<Parameters>
			<Parameter>
				<Name>Case Structure</Name>
				<Description>XML file generated by jCOLIBRI tools</Description>
				<DataType>File</DataType>
			</Parameter>
		</Parameters>
		<Competencies>
			<Competence>Prepare Cases for Adaptation Task</Competence>
		</Competencies>
</Method>



<Method>
		<Name>jcolibri.method.CombineQueryAndCasesMethod</Name>
		<Description>Copies Query description into retrieved cases</Description>
		<Type>Resolution</Type>
		<Competencies>
			<Competence>Atomic Reuse Task</Competence>
		</Competencies>
</Method>

<Method>
		<Name>jcolibri.method.DirectCopyMethod</Name>
		<Description>Copies a Description attribute value to a solution attribute</Description>
		<Type>Resolution</Type>
		<Parameters>
			<Parameter>
				<Name>Description Attribute</Name>
				<Description>Attribute from Description to be copied</Description>
				<DataType>String</DataType>
			</Parameter>
			<Parameter>
				<Name>Solution Attribute</Name>
				<Description>Attribute from Solution where value must be stored</Description>
				<DataType>String</DataType>
			</Parameter>
		</Parameters>
		<Competencies>
			<Competence>Atomic Reuse Task</Competence>
		</Competencies>
	</Method>

<Method>
		<Name>jcolibri.method.NumericDirectProportionMethod</Name>
		<Description>Computes a direct proportion between NUMERIC description attributes and solution attributes.</Description>
		<Type>Resolution</Type>
		<Parameters>
			<Parameter>
				<Name>Description Attribute</Name>
				<Description>Attribute from Description that indicates the proportion</Description>
				<DataType>String</DataType>
			</Parameter>
			<Parameter>
				<Name>Solution Attribute</Name>
				<Description>Attribute from Solution where proportion must be stored</Description>
				<DataType>String</DataType>
			</Parameter>
		</Parameters>
		<Competencies>
			<Competence>Atomic Reuse Task</Competence>
		</Competencies>
</Method>

		<Method>
		<Name>jcolibri.method.ManualRevisionMethod</Name>
		<Description>Allows user to modify cases</Description>
		<Type>Resolution</Type>
		<Parameters>
			<Parameter>
				<Name>Case Structure</Name>
				<Description>XML file generated by jCOLIBRI tools</Description>
				<DataType>File</DataType>
			</Parameter>
		</Parameters>
		<Competencies>
			<Competence>Revise Task</Competence>
		</Competencies>
	</Method>


	<Method>
		<Name>jcolibri.method.RetainComputationalMethod</Name>
		<Description>Simple retain strategy</Description>
		<Type>Decomposition</Type>
		<Competencies>
			<Competence>Retain Task</Competence>
		</Competencies>
		<SubTasks>
			<SubTask>Select cases to store task</SubTask>
			<SubTask>Store cases task</SubTask>
		</SubTasks>
	</Method>
	<Method>
		<Name>jcolibri.method.RetainChooserMethod</Name>
		<Description>Allows user to choose cases to store</Description>
		<Type>Resolution</Type>
		<Parameters>
			<Parameter>
				<Name>Case Structure</Name>
				<Description>XML file generated by jCOLIBRI tools</Description>
				<DataType>File</DataType>
			</Parameter>
		</Parameters>
		<Competencies>
			<Competence>Select cases to store task</Competence>
		</Competencies>
	</Method>
	
	<Method>
		<Name>jcolibri.method.StoreCasesMethod</Name>
		<Description>Stores cases into CaseBase</Description>
		<Type>Resolution</Type>
		<Competencies>
			<Competence>Store cases task</Competence>
		</Competencies>
	</Method>

</Methods>

